{
  "$schema": "http://json-schema.org/draft-07/schema#",
  "$id": "https://multicode.dev/schemas/sprintengine-role-manifest.json",
  "title": "Sprint Engine role manifest",
  "description": "A declarative Sprint Engine role. Pure data: the runtime composes the agent prompt from the referenced skill ids. No code is executed, so third-party roles are safe to install (Tier 1). Mirror of src/shared/sprintengine/role-manifest.ts.",
  "type": "object",
  "required": ["id", "label", "soul"],
  "additionalProperties": false,
  "properties": {
    "id": {
      "type": "string",
      "pattern": "^[a-z][a-z0-9_]{0,62}$",
      "description": "Lowercase snake_case identifier, 1–63 chars."
    },
    "label": {
      "type": "string",
      "minLength": 1,
      "description": "Human-readable role name, sentence case."
    },
    "summary": {
      "type": "string",
      "description": "One-line description of what the role does."
    },
    "aliases": {
      "type": "array",
      "description": "Alternate ids that resolve to this role.",
      "items": {
        "type": "string",
        "pattern": "^[a-z][a-z0-9_-]{0,62}$"
      }
    },
    "capabilities": {
      "type": "array",
      "description": "Declarative role capabilities. Capabilities describe what the role can do; they do not make gates globally required.",
      "items": {
        "type": "object",
        "required": ["kind"],
        "additionalProperties": false,
        "properties": {
          "kind": {
            "type": "string",
            "enum": ["review"]
          },
          "phase": {
            "type": "string",
            "enum": ["review", "testing", "product"],
            "description": "Quality-gate phase this role can serve when the architect requires it. Defaults to review."
          },
          "reviews": {
            "type": "array",
            "description": "Optional capability tags this role is suited to review.",
            "items": {
              "type": "string",
              "pattern": "^[a-z][a-z0-9_]{0,62}$"
            }
          },
          "defaultFocus": {
            "type": "string",
            "description": "Default gate focus text used when the architect requires this role as a gate."
          }
        }
      }
    },
    "soul": {
      "type": "array",
      "description": "Ordered skill references composing the role's prompt.",
      "minItems": 1,
      "items": {
        "type": "object",
        "required": ["skill"],
        "additionalProperties": false,
        "properties": {
          "skill": {
            "type": "string",
            "pattern": "^[a-z][a-z0-9_]{0,62}$"
          }
        }
      }
    }
  }
}
