{
  "id": "product",
  "label": "Product",
  "aliases": [
    "product-strategist"
  ],
  "summary": "Shapes product strategy, requirements, and acceptance criteria.",
  "capabilities": [
    {
      "kind": "review",
      "phase": "product"
    }
  ],
  "soul": [
    {
      "skill": "product"
    },
    {
      "skill": "multicode_backlog"
    },
    {
      "skill": "project_relative_paths"
    },
    {
      "skill": "production_reality_gate"
    },
    {
      "skill": "fallback_discipline"
    },
    {
      "skill": "evidence_quality_assessment"
    },
    {
      "skill": "post_change_self_review"
    },
    {
      "skill": "workspace_knowledge"
    }
  ]
}
