{
  "id": "ui_ux_reviewer",
  "label": "UI/UX Reviewer",
  "aliases": [
    "ui-ux-review",
    "frontend-ui-review",
    "frontend-ux-review",
    "brand-ui-review"
  ],
  "summary": "Reviews frontend UX, UI consistency, brand alignment, responsive behavior, and visual polish.",
  "capabilities": [
    {
      "kind": "review",
      "phase": "review",
      "reviews": [
        "ui_quality",
        "ux",
        "brand",
        "responsive_behavior"
      ],
      "defaultFocus": "frontend UX, UI consistency, brand alignment, responsive behavior, and visual polish"
    }
  ],
  "soul": [
    {
      "skill": "ui_ux_reviewer"
    },
    {
      "skill": "project_relative_paths"
    },
    {
      "skill": "production_reality_gate"
    },
    {
      "skill": "fallback_discipline"
    },
    {
      "skill": "evidence_quality_assessment"
    },
    {
      "skill": "post_change_self_review"
    },
    {
      "skill": "workspace_knowledge"
    }
  ]
}
