{
  "id": "security",
  "label": "Security",
  "aliases": [
    "security-review"
  ],
  "summary": "Reviews systems for security, privacy, and abuse risks.",
  "soul": [
    {
      "skill": "security"
    },
    {
      "skill": "project_relative_paths"
    },
    {
      "skill": "production_reality_gate"
    },
    {
      "skill": "fallback_discipline"
    },
    {
      "skill": "evidence_quality_assessment"
    },
    {
      "skill": "post_change_self_review"
    },
    {
      "skill": "collaboration_norms"
    },
    {
      "skill": "workspace_knowledge"
    }
  ]
}
