{
  "id": "devops",
  "label": "DevOps",
  "aliases": [
    "devops-infra"
  ],
  "summary": "Handles infrastructure, deployment, CI/CD, and operational reliability.",
  "soul": [
    {
      "skill": "devops"
    },
    {
      "skill": "project_relative_paths"
    },
    {
      "skill": "production_reality_gate"
    },
    {
      "skill": "fallback_discipline"
    },
    {
      "skill": "evidence_quality_assessment"
    },
    {
      "skill": "post_change_self_review"
    },
    {
      "skill": "collaboration_norms"
    },
    {
      "skill": "workspace_knowledge"
    },
    {
      "skill": "sprintengine_workflow"
    }
  ]
}
