{
  "id": "nuclear_reviewer",
  "label": "Nuclear Reviewer",
  "aliases": [
    "nuclear-review",
    "nuclear-reviewer"
  ],
  "summary": "Runs a strict maintainability review for structure, abstraction, large-file, and spaghetti-growth risks.",
  "capabilities": [
    {
      "kind": "review",
      "phase": "review",
      "reviews": [
        "implementation",
        "maintainability",
        "architecture_quality"
      ],
      "defaultFocus": "structural maintainability, abstraction quality, large-file risk, special-case sprawl, and codebase design decay"
    }
  ],
  "soul": [
    {
      "skill": "nuclear_reviewer"
    }
  ]
}
