{
  "id": "frontend",
  "label": "Frontend",
  "aliases": [
    "frontend-design-review"
  ],
  "summary": "Builds and reviews user-facing application experiences.",
  "soul": [
    {
      "skill": "frontend"
    },
    {
      "skill": "project_relative_paths"
    },
    {
      "skill": "production_reality_gate"
    },
    {
      "skill": "fallback_discipline"
    },
    {
      "skill": "evidence_quality_assessment"
    },
    {
      "skill": "post_change_self_review"
    },
    {
      "skill": "collaboration_norms"
    },
    {
      "skill": "workspace_knowledge"
    },
    {
      "skill": "sprintengine_workflow"
    }
  ]
}
