{
  "id": "blog_writer",
  "label": "Blog Writer",
  "aliases": [
    "blog-writer",
    "content-writer",
    "blogger"
  ],
  "summary": "Writes and edits publishable long-form content.",
  "soul": [
    {
      "skill": "blog_writer"
    },
    {
      "skill": "project_relative_paths"
    },
    {
      "skill": "production_reality_gate"
    },
    {
      "skill": "fallback_discipline"
    },
    {
      "skill": "evidence_quality_assessment"
    },
    {
      "skill": "post_change_self_review"
    },
    {
      "skill": "collaboration_norms"
    },
    {
      "skill": "workspace_knowledge"
    },
    {
      "skill": "sprintengine_workflow"
    }
  ]
}
