{
  "id": "developer",
  "label": "Developer",
  "aliases": [],
  "summary": "Implements reliable backend and core software changes.",
  "soul": [
    {
      "skill": "developer"
    },
    {
      "skill": "project_relative_paths"
    },
    {
      "skill": "production_reality_gate"
    },
    {
      "skill": "fallback_discipline"
    },
    {
      "skill": "evidence_quality_assessment"
    },
    {
      "skill": "post_change_self_review"
    },
    {
      "skill": "collaboration_norms"
    },
    {
      "skill": "workspace_knowledge"
    }
  ]
}
