{
  "id": "performance",
  "label": "Performance",
  "aliases": [
    "performance-engineer"
  ],
  "summary": "Reviews performance, scalability, and resource-use risks.",
  "soul": [
    {
      "skill": "performance"
    },
    {
      "skill": "project_relative_paths"
    },
    {
      "skill": "production_reality_gate"
    },
    {
      "skill": "fallback_discipline"
    },
    {
      "skill": "evidence_quality_assessment"
    },
    {
      "skill": "post_change_self_review"
    },
    {
      "skill": "collaboration_norms"
    },
    {
      "skill": "workspace_knowledge"
    },
    {
      "skill": "sprintengine_workflow"
    }
  ]
}
