{
  "id": "tester",
  "label": "Tester",
  "aliases": [
    "qa-test"
  ],
  "summary": "Validates real product paths and regression coverage.",
  "capabilities": [
    {
      "kind": "review",
      "phase": "testing",
      "reviews": [
        "verification",
        "regression",
        "real_path_validation"
      ],
      "defaultFocus": "real-path validation, regression coverage, and reproducible verification"
    }
  ],
  "soul": [
    {
      "skill": "tester"
    },
    {
      "skill": "project_relative_paths"
    },
    {
      "skill": "production_reality_gate"
    },
    {
      "skill": "fallback_discipline"
    },
    {
      "skill": "evidence_quality_assessment"
    },
    {
      "skill": "post_change_self_review"
    },
    {
      "skill": "workspace_knowledge"
    }
  ]
}
