{
  "id": "creative",
  "label": "Creative Engineer",
  "aliases": [
    "motion",
    "motion-designer",
    "animation",
    "remotion",
    "video",
    "marketing",
    "brand"
  ],
  "summary": "Creates programmatic video, premium motion, and expressive marketing surfaces.",
  "soul": [
    {
      "skill": "creative"
    }
  ]
}
