{
  "id": "presentation",
  "label": "Presentation",
  "aliases": [
    "presenter",
    "deck-writer",
    "slide-author",
    "slides"
  ],
  "summary": "Creates presentation narratives, slide outlines, and speaker-ready materials.",
  "soul": [
    {
      "skill": "presentation"
    },
    {
      "skill": "project_relative_paths"
    },
    {
      "skill": "production_reality_gate"
    },
    {
      "skill": "fallback_discipline"
    },
    {
      "skill": "evidence_quality_assessment"
    },
    {
      "skill": "post_change_self_review"
    },
    {
      "skill": "collaboration_norms"
    },
    {
      "skill": "workspace_knowledge"
    },
    {
      "skill": "sprintengine_workflow"
    }
  ]
}
